{"artifacts":{"junit.xml":"2e90a635f7359fc8acf412c4d9610a00feea05b6833a9d9307ae5a8cb8be28fe","test-output.txt":"3948b50949509262ccdd1ac01f1d214794f94cb118d3d1df1f818f47e4c1e930"},"command":["/workspace/ZORG/.venv/bin/python","-m","pytest","-q","--junitxml","/workspace/ZORG/outputs/build0_regression_live_01/tests/junit.xml"],"counts":{"errors":0,"failed":0,"passed":642,"skipped":0},"exit_code":0,"families":{"V01":true,"V02":true,"V03":true,"V04":true,"V05":true,"V06":true,"V07":true,"V08":true,"V09":true,"V10":true,"V11":true,"V12":true},"passed":true,"schema_version":"cz-tests-0.3","source_digest":"362d508f040131bd2be263d02045f9a4ff1b760779b50323fe7b5091d53d02c2","summary":"642 passed; 0 failed; 0 errors; 0 skipped"}
