{"artifacts":{"junit.xml":"32f15d5f32946449bb5e69885b58a66be9ac03020b90ff2b231406a52da2c94c","test-output.txt":"c5427e7a85751c4a37071a39cc4a849fcf49b913e70ec7778b679694b6bf26c8"},"command":["/workspace/ZORG/.venv/bin/python","-m","pytest","-q","--junitxml","/workspace/ZORG/outputs/build02_final_regression/tests/junit.xml"],"counts":{"errors":0,"failed":0,"passed":716,"skipped":0},"exit_code":0,"families":{"V01":true,"V02":true,"V03":true,"V04":true,"V05":true,"V06":true,"V07":true,"V08":true,"V09":true,"V10":true,"V11":true,"V12":true},"passed":true,"schema_version":"cz-tests-0.3","source_digest":"24d41da2eb68f966921acaa44352fdf2074f8a397e0768e94d211a22a8ba9441","summary":"716 passed; 0 failed; 0 errors; 0 skipped"}
